{
  "id": "obs-20260702-synthetic-reading-correction",
  "schema": "observation-record.v1",
  "kind": "correction",
  "occurredAt": "2026-07-02T10:00:00Z",
  "recordedAt": "2026-07-02T10:01:00Z",
  "subject": { "type": "synthetic-example", "id": "correction-chain" },
  "observations": [
    { "name": "corrected-draft-label", "value": "north-east" }
  ],
  "method": {
    "kind": "calculation",
    "name": "synthetic fixture correction",
    "limitations": ["This is test data, not a project observation."]
  },
  "provenance": {
    "sourceRole": "derived",
    "sources": [
      {
        "locator": "chronicle/examples/correction-chain/obs-20260701-synthetic-reading.json",
        "role": "derived-from",
        "sha256": "2b57e730223627faba36476f84a2c6e7d8ffcf27cf3f63b33535f9eea4d5c987"
      }
    ]
  },
  "quality": {
    "status": "reviewed",
    "limitations": ["The correction changes the label, not the historical existence of the first record."]
  },
  "observer": { "kind": "agent", "id": "synthetic-corrector" },
  "recorder": { "kind": "tool", "id": "test-fixture" },
  "classification": "internal",
  "correctionOf": "obs-20260701-synthetic-reading"
}
